title,description
In Lovely Blueness (number one),"In Lovely Blueness (Number One) (1940) by Wassily Kandinsky: 'In Lovely Blueness (Number One)' embodies the ethereal beauty and spiritual depth that Wassily Kandinsky often sought to evoke in his abstract works. Dominated by a rich palette of blues, the painting features dynamic geometric shapes and organic forms, interwoven to create a sense of movement. Kandinsky, who saw color as a conduit to emotional expression, imbues the work with a sense of calm, yet energetic tranquility. The composition seems to vibrate with life, suggesting a cosmic unity, while also invoking the melancholy associated with blue. It is a visual representation of the artist’s belief that color could transcend mere visual perception and touch the spiritual realm."
Nu sur fond rouge,"Nu sur fond rouge (1917) by Amedeo Modigliani: 'Nu sur fond rouge' captures the sensuality and elegance for which Amedeo Modigliani is renowned. The painting features a reclining nude woman, her body elongated and simplified in the artist's signature style. The red background, vivid and intense, contrasts sharply with the soft, fluid lines of the figure, enhancing the subject's vulnerability and intimacy. Modigliani’s focus on the purity of form and the human figure, combined with his abstraction of features, creates a serene yet poignant atmosphere. This piece exemplifies Modigliani’s ability to blend sensuality with quiet reflection, rendering the human body as both a subject of beauty and a vehicle for emotional expression."
"Paul Guillaume, Novo Pilota","Paul Guillaume, Novo Pilota (1915) by Amedeo Modigliani: In 'Paul Guillaume, Novo Pilota,' Modigliani portrays the art dealer Paul Guillaume in his typically elongated, minimalist style. The subject is depicted with a simplicity that suggests an underlying complexity, an introspective and almost meditative quality. Guillaume's figure is slender and elongated, his face simplified to its essential lines and forms, a hallmark of Modigliani’s approach to portraiture. The muted tones of the background and the subtle shading highlight the figure, drawing the viewer’s focus to the quiet dignity and grace of the subject. The piece reflects the artist’s deep understanding of his subjects, capturing both their physical presence and the intangible qualities that define them."
Antonia,"Antonia (1917) by Amedeo Modigliani: Antonia is a portrait of the artist’s lover, capturing her in a serene, almost spiritual pose. Modigliani’s characteristic elongated forms and minimalist approach to facial features are evident, with the subject’s smooth, sculptural lines evoking a sense of calm and elegance. The portrait is stripped of extraneous detail, focusing instead on the purity of the form. The soft background provides contrast to the sharpness of the figure, creating an interplay of stillness and subtle tension. The painting emphasizes the intimate connection between the artist and his muse, rendered in the timeless beauty of Modigliani's signature style."
Le jeune Apprenti,"Le jeune Apprenti (1919) by Amedeo Modigliani: 'Le jeune Apprenti' is a portrait of a young apprentice, rendered with Modigliani’s signature elongated lines and stylized forms. The apprentice’s features are minimal yet expressive, capturing a moment of quiet contemplation. The painting’s simplicity speaks volumes, with the subject’s posture suggesting both youth and the passage into maturity. The muted color palette and soft lines enhance the work's introspective quality, focusing the viewer’s attention on the subject’s calm expression and serene presence. This portrait, like many of Modigliani's works, evokes a sense of timelessness, highlighting the inner life of the subject through abstraction and minimalism."
Les Adolescents,"Les Adolescents (1919) by Amedeo Modigliani: In Les Adolescents, Modigliani captures the moment of transition between childhood and adulthood. The figures, two young adolescents, are elongated and simplified, their faces rendered with minimal features that suggest innocence and the complex emotions of adolescence. The subdued tones and gentle curves evoke a sense of stillness, but there is a palpable tension between the youthful figures and the subtle, muted background. The composition speaks to the beauty and fragility of youth, and Modigliani’s treatment of the figures reflects his ongoing exploration of form and the emotional depth beneath the surface."
Femme au chapeau blanc,"Femme au chapeau blanc (1918) by Amedeo Modigliani: Femme au chapeau blanc features a woman with a white hat, rendered in Modigliani's signature elongated style. The hat, bold against the simplicity of the subject’s form, draws attention to the woman’s graceful neck and minimalist features. Modigliani’s approach to portraiture is both modern and timeless, reducing the figure to essential lines while retaining a sense of individuality and character. The soft color palette and stylized facial features create a serene, almost otherworldly atmosphere, emphasizing the subject’s elegance and inner calm."
Grande baigneuse,"Grande baigneuse (1916) by Amedeo Modigliani: Grande baigneuse is a monumental nude, embodying Modigliani’s fascination with the human form. The figure is elongated and graceful, exuding a sense of calm and serenity. The smooth, sculptural lines of the woman’s body are juxtaposed against a more textured, abstracted background. The simplicity of the figure, coupled with the intense focus on its curves and proportions, emphasizes Modigliani’s exploration of the body as a vehicle for both beauty and emotional expression. The painting is a meditative reflection on the nude form, capturing both the vulnerability and strength inherent in the human body."
Femme au tambourin,"Femme au tambourin (1919) by Amedeo Modigliani: Femme au tambourin depicts a woman holding a tambourine, an instrument often associated with music and celebration. The figure’s elongated features and minimalistic style convey a sense of grace and sensuality. Modigliani's abstract treatment of the face and body focuses attention on the woman’s pose and the rhythmic quality of the tambourine, suggesting an almost musical quality to the composition. The painting's simplicity does not detract from its emotional resonance, and the subject's quiet confidence is captured through Modigliani’s distinctive approach to form."
La Table de cuisine,"La Table de cuisine (1916) by Juan Gris: La Table de cuisine is a still life by Juan Gris, rendered in the Cubist style that he helped to develop. The fragmented forms of everyday kitchen objects—plates, cups, and utensils—are arranged with analytical precision, their geometric shapes broken into planes and angles. Gris uses muted tones to create a sense of depth and texture, emphasizing the structure of the objects rather than their naturalistic appearance. The composition is a study in both abstraction and reality, presenting the viewer with an intellectual challenge while also conveying a quiet, reflective atmosphere. The painting exemplifies Gris’s mastery of Cubism, turning the mundane into a visually complex and emotionally resonant work."
La Gibeciere,"La Gibecière (1917) by Amedeo Modigliani: La Gibecière is a portrait of a woman, rendered in Modigliani’s characteristic elongated style, holding a hunting bag (the 'gibecière' in French). The painting conveys a sense of stillness and grace, with the figure’s simplified features and long neck emphasizing the purity of form. The subject’s direct gaze engages the viewer, while the minimalist background keeps the focus on her figure. The use of earthy tones and the interplay between light and shadow evoke a mood of quiet contemplation. Modigliani’s approach to portraiture, blending abstraction with emotional depth, makes this work a poignant reflection of both the external and internal world of the subject."
Arlequin a la guitare,"Arlequin à la guitare (1918) by Amedeo Modigliani: Arlequin à la guitare is a portrait of a harlequin, a character from the commedia dell'arte tradition, depicted with an elongated form and a stylized face in Modigliani’s signature approach. The figure is shown playing the guitar, and the elongated proportions of the body create a sense of elegance and fluidity. Modigliani’s use of color is both vibrant and subdued, with the character’s costume in muted tones contrasting with the lively, rhythmic pose. The guitar becomes a symbol of both artistry and melancholy, and the entire composition radiates a sense of emotional depth despite its apparent simplicity. This piece reflects Modigliani’s ability to blend the theatrical with the intimate, creating a portrait that is both personal and expressive. Artist: Amedeo Modigliani, Title: Arlequin à la guitare, Date: 1918, Size: 81 x 60 cm, Location: Private Collection."
La Cariole du pere junier,"La Cariole du père Junier (1919) by Amedeo Modigliani: La Cariole du père Junier features a rural scene of a cart (cariole) driven by the figure of Père Junier, an elder from Modigliani’s community in the South of France. The cart is rendered in the artist’s typical minimalistic style, with simple lines and a muted color palette. Modigliani’s focus on form over detail creates a sense of calm and quiet dignity in the painting, with the cart and its driver standing as symbols of the rural life. The figure of Père Junier is portrayed with an economy of strokes, capturing the essence of age and experience. The surrounding landscape is left sparse, allowing the figure and the cart to occupy a central, almost symbolic space in the composition. Artist: Amedeo Modigliani, Title: La Cariole du père Junier, Date: 1919, Size: 50 x 70 cm, Location: Private Collection."
Portrait de Madame M.,"Portrait de Madame M. (1918) by Amedeo Modigliani: In Portrait de Madame M., Modigliani paints a dignified portrait of a woman, whose identity remains partially veiled in the simplicity of the composition. The subject is shown in Modigliani’s signature elongated form, her features minimized yet expressive. The long neck and flowing curves of the body are complemented by the subject’s serene expression, which conveys both grace and mystery. The muted tones of the background create a quiet, introspective atmosphere, allowing the viewer to focus on the woman’s character. Modigliani’s ability to capture the inner life of his subjects is evident here, as he explores the balance between abstraction and emotional depth. Artist: Amedeo Modigliani, Title: Portrait de Madame M., Date: 1918, Size: 70 x 50 cm, Location: Private Collection."
La Noce,"La Noce (1919) by Amedeo Modigliani: La Noce, meaning 'The Wedding,' is a celebration of love and union, depicted in Modigliani’s signature style. The painting features a couple in the midst of a wedding ceremony, their elongated forms rendered with grace and simplicity. Modigliani’s characteristic treatment of the human body emphasizes the emotional connection between the figures, with their expressive faces and intertwined postures. The muted background, with its soft colors, contrasts with the vivid energy of the couple, highlighting the significance of their bond. The painting speaks to Modigliani’s ability to convey intimate moments with sensitivity and poetic beauty, blending abstraction with universal themes of love and connection. Artist: Amedeo Modigliani, Title: La Noce, Date: 1919, Size: 77 x 59 cm, Location: Private Collection."
Les Biches,"Les Biches (1918) by Amedeo Modigliani: Les Biches, meaning 'The Does,' is a portrait of two women, who appear together in a moment of quiet interaction. Their elongated forms, softened facial features, and gentle poses are hallmarks of Modigliani’s style. The use of minimal detail and abstraction allows the viewer to focus on the emotional depth and connection between the subjects. The rich color palette of muted tones contrasts with the softness of the figures, creating an atmosphere of intimacy and serenity. Modigliani’s treatment of the female form in this piece speaks to his deep understanding of both beauty and vulnerability, as he captures the essence of feminine grace and presence. Artist: Amedeo Modigliani, Title: Les Biches, Date: 1918, Size: 92 x 60 cm, Location: Private Collection."
Femmes au chien,"Femmes au chien (1918) by Amedeo Modigliani: Femmes au chien is a portrait of a woman with a dog, two figures whose connection is rendered with Modigliani’s characteristic simplicity and elegance. The woman is portrayed in the artist’s typical elongated form, with minimal facial features, and the dog is depicted in a similarly stylized manner. The figures are placed in a muted, abstracted background, allowing them to emerge as the focal point of the composition. The dog, often a symbol of loyalty, enhances the theme of connection and companionship, making the painting a reflection on the human-animal bond. The emotional depth of the portrait is conveyed through the quiet, intimate interaction between the two subjects. Artist: Amedeo Modigliani, Title: Femmes au chien, Date: 1918, Size: 85 x 60 cm, Location: Private Collection."
Danseuses espagnoles,"Danseuses espagnoles (1919) by Amedeo Modigliani: Danseuses espagnoles is a vibrant depiction of Spanish dancers, rendered in Modigliani’s characteristic elongated style. The dancers’ graceful postures and flowing dresses evoke the movement and energy of the traditional Spanish dance, yet the painting retains the artist’s minimalist approach to form. The muted background contrasts with the energy of the dancers, whose bodies are captured in fluid, sweeping lines that suggest both movement and grace. Modigliani’s focus on form and expression allows the painting to transcend mere representation, evoking the passion and rhythm of the dance. The work speaks to Modigliani’s ability to capture not only the external appearance of his subjects but their inner life as well. Artist: Amedeo Modigliani, Title: Danseuses espagnoles, Date: 1919, Size: 92 x 60 cm, Location: Private Collection."
Portrait de femme a la colombe,"Portrait de femme à la colombe (1919) by Amedeo Modigliani: Portrait de femme à la colombe depicts a woman holding a dove, a symbol of peace and purity. The woman’s elongated form, coupled with her serene expression, creates a sense of calm and grace. Modigliani’s minimalist approach to the figure enhances the emotional depth of the portrait, allowing the viewer to focus on the subject’s quiet strength. The dove, delicately held in her hands, adds an element of symbolism to the work, representing both peace and femininity. The muted tones of the background allow the subject to stand out, making her the focal point of the composition. The painting captures a sense of spiritual elegance, blending Modigliani’s abstracted style with the timeless theme of human connection and peace. Artist: Amedeo Modigliani, Title: Portrait de femme à la colombe, Date: 1919, Size: 77 x 59 cm, Location: Private Collection."
Portrait de Madame Paul Guillaume,"Portrait de Madame Paul Guillaume (1918) by Amedeo Modigliani: In Portrait de Madame Paul Guillaume, Modigliani presents a refined, dignified portrait of the wife of the prominent art dealer. The painting reflects Modigliani’s typical elongated style, with minimal features that emphasize the figure’s grace and inner strength. The subject’s calm expression and elegant posture convey both her social stature and her personal intimacy with the artist. The soft, muted colors of the background allow the figure to emerge as the central focus, and Modigliani’s ability to reduce the human form to its essence makes this portrait both a psychological and aesthetic study. The work reflects Modigliani’s fascination with the human soul and his unique approach to capturing character through abstraction. Artist: Amedeo Modigliani, Title: Portrait de Madame Paul Guillaume, Date: 1918, Size: 81 x 65 cm, Location: Private Collection."
Portrait d'homme (Emile Lejeune),"Portrait d'homme (Emile Lejeune) is a portrait of Emile Lejeune, an important figure, captured with a focus on his dignified expression and presence. The figure is rendered in a minimalist style, with simplified features and elongated proportions typical of Modigliani's technique. The muted background and lack of excessive detail allow the subject to stand out, with the composition conveying both strength and subtle introspection. The elegant treatment of the face and figure reflects Modigliani's ability to capture the essence of his subject’s personality. Artist: Amedeo Modigliani, Title: Portrait d'homme (Emile Lejeune), Date: 1918, Size: 73 x 60 cm, Location: Private Collection."
LE Dindon,"LE Dindon is a still life featuring a turkey, rendered in Modigliani’s signature minimalistic and abstract style. The bird is simplified, with elongated shapes and a muted color palette, drawing focus to the form and essence of the subject rather than intricate detail. Modigliani’s use of color contrasts with the subdued tones of the background, giving the composition a sense of quiet elegance. The piece reflects his ability to transform even a simple subject into a work of emotional depth. Artist: Amedeo Modigliani, Title: LE Dindon, Date: 1918, Size: 55 x 46 cm, Location: Private Collection."
Le Poulet plume,"Le Poulet plume is another still life by Modigliani, showcasing a chicken in a similarly abstracted, elongated style. The chicken is depicted with soft, flowing lines that emphasize the shape and movement of the subject. Modigliani’s use of muted earth tones creates a warm, grounded atmosphere, while the sparse background draws the viewer’s attention to the subject. The painting is a study in minimalism, transforming the ordinary into something of grace and dignity. Artist: Amedeo Modigliani, Title: Le Poulet plume, Date: 1918, Size: 52 x 41 cm, Location: Private Collection."
La Table,"La Table is a still life composition focused on a table, rendered in Modigliani’s signature elongated style. The table is shown in a simplified, abstracted form, with the focus on the interplay of shapes and colors. The minimal detail of the objects on the table allows the viewer to concentrate on the emotional atmosphere of the piece, which is both tranquil and contemplative. Modigliani’s characteristic muted color palette creates a sense of harmony and introspection. Artist: Amedeo Modigliani, Title: La Table, Date: 1918, Size: 65 x 50 cm, Location: Private Collection."
Le Lapin,"Le Lapin is a still life painting of a rabbit, rendered with Modigliani’s signature elegance and simplicity. The rabbit is depicted with soft, elongated lines, emphasizing its form without excessive detail. The muted background and sparse composition focus the viewer's attention on the animal, creating a sense of quiet dignity. The painting is a reflection on Modigliani’s ability to elevate everyday subjects into works of art that evoke emotional depth. Artist: Amedeo Modigliani, Title: Le Lapin, Date: 1918, Size: 60 x 50 cm, Location: Private Collection."
Nature morte au faisan,"Nature morte au faisan is a still life of a pheasant, painted with Modigliani’s characteristic minimalism. The bird is rendered with elongated forms and muted tones, allowing the color of the bird’s feathers to contrast subtly with the background. The absence of intricate detail adds to the quiet elegance of the composition, as Modigliani’s style highlights the beauty of the subject in its simplest form. Artist: Amedeo Modigliani, Title: Nature morte au faisan, Date: 1918, Size: 57 x 46 cm, Location: Private Collection."
La jeune Anglaise,"La jeune Anglaise is a portrait of a young English woman, painted in Modigliani’s elongated, stylized manner. The subject is depicted with a serene expression and graceful proportions, with minimal detail in her facial features. The background is kept simple, allowing the viewer to focus on the woman’s character and presence. The piece exemplifies Modigliani’s skill in capturing the inner life of his subjects through abstraction and simplicity. Artist: Amedeo Modigliani, Title: La jeune Anglaise, Date: 1918, Size: 70 x 50 cm, Location: Private Collection."
Le Garcon d'etage,"Le Garçon d'étage portrays a young man in a dignified pose, using Modigliani’s characteristic elongated forms. The subject’s facial features are simplified, but his posture conveys strength and introspection. The muted tones of the background contrast with the expressive presence of the figure, creating an aura of quiet elegance. This work demonstrates Modigliani’s ability to reduce his subjects to their essence, capturing both physical grace and emotional depth. Artist: Amedeo Modigliani, Title: Le Garçon d'étage, Date: 1918, Size: 80 x 60 cm, Location: Private Collection."
L'Enfant a la poupee,"L'Enfant à la poupée is a portrait of a child holding a doll, rendered with Modigliani’s elongated and minimalist style. The child’s expression is serene yet mysterious, and the doll, a symbol of innocence, adds a layer of emotional depth to the composition. Modigliani’s simple yet powerful use of form and color creates a sense of calm, while the subject’s pose evokes a timeless sense of childhood purity. Artist: Amedeo Modigliani, Title: L'Enfant à la poupée, Date: 1918, Size: 70 x 60 cm, Location: Private Collection."
Les Pecheurs a la ligne,"Les Pecheurs à la ligne is a depiction of fishermen at the water’s edge, shown with Modigliani’s signature elongated forms. The fishermen are portrayed in a minimalist, almost abstract style, with simplified details that emphasize the emotional connection between the figures and their environment. The quiet atmosphere and muted color palette create a sense of calm and reflection, conveying the universal theme of human connection to nature. Artist: Amedeo Modigliani, Title: Les Pecheurs à la ligne, Date: 1918, Size: 80 x 65 cm, Location: Private Collection."
La Fabrique de Chaise a Alfortville,"La Fabrique de Chaise à Alfortville is a scene of a chair factory in Alfortville, painted with Modigliani’s characteristic minimalism. The workers are depicted in simplified forms, focusing on their actions and the environment rather than intricate details. The muted tones of the background contrast with the figures, highlighting the human effort involved in the creation of furniture. The work reflects Modigliani’s ability to capture the essence of everyday life through abstraction. Artist: Amedeo Modigliani, Title: La Fabrique de Chaise à Alfortville, Date: 1918, Size: 90 x 65 cm, Location: Private Collection."
La Fabrique de Chaise,"La Fabrique de Chaise is a painting of a chair factory scene, rendered in Modigliani’s signature abstract style. The workers are shown with elongated, simplified forms, emphasizing their movements rather than focusing on detail. The muted color palette creates a calm, almost meditative atmosphere, inviting the viewer to reflect on the dignity of manual labor. The composition captures both the physical and emotional presence of the workers in a minimalist fashion. Artist: Amedeo Modigliani, Title: La Fabrique de Chaise, Date: 1918, Size: 92 x 70 cm, Location: Private Collection."
La Falaise,"La Falaise is a landscape painting depicting a cliff or bluff, rendered with Modigliani’s characteristic simplicity. The forms are elongated, and the use of muted colors creates a sense of quiet strength in the natural environment. The lack of detail in the background emphasizes the grandeur of the cliff itself, capturing its elemental power while maintaining Modigliani’s abstract approach. Artist: Amedeo Modigliani, Title: La Falaise, Date: 1918, Size: 60 x 45 cm, Location: Private Collection."
Le Navire dans la Tempete,"Le Navire dans la Tempête is a dramatic depiction of a ship in a storm, painted with Modigliani’s elongated figures and minimalist style. The turbulent sea and the ship’s struggle against the waves are conveyed through abstract shapes and forms, creating a powerful emotional impact. The muted tones of the sky and water contrast with the energy of the ship, reflecting the struggle between man and nature. Artist: Amedeo Modigliani, Title: Le Navire dans la Tempête, Date: 1918, Size: 100 x 80 cm, Location: Private Collection."
Femme au violon,"Femme au violon is a portrait of a woman playing the violin, rendered with Modigliani’s signature elongated style. The subject’s graceful posture and serene expression are enhanced by the minimalist background, which allows the focus to remain on her form and the elegance of the instrument. The violin, symbolizing music and emotion, adds depth to the piece, reflecting Modigliani’s ability to convey the internal world of his subjects through abstracted forms. Artist: Amedeo Modigliani, Title: Femme au violon, Date: 1919, Size: 75 x 60 cm, Location: Private Collection."
Femme a la mandoline,"Femme à la mandoline is a portrait of a woman holding a mandolin, painted in Modigliani’s elongated style. The simplicity of the form and the focus on the subject’s emotional expression convey a sense of intimacy and grace. The mandolin, an instrument of music, adds an element of rhythm and harmony to the piece. Modigliani’s minimalist approach emphasizes the connection between the figure and the instrument, creating a portrait that is both abstract and emotionally resonant. Artist: Amedeo Modigliani, Title: Femme à la mandoline, Date: 1919, Size: 80 x 60 cm, Location: Private Collection."
