title,description
Odalisque bleue or L'esclave blanche,"Odalisque bleue (also known as L'esclave blanche) is a portrait of a reclining female figure rendered in Modigliani’s characteristic elongated style. The subject is depicted in an intimate  sensual pose with her form simplified and abstracted. The blue tones in the painting evoke a sense of calm and tranquility while the figure's expression is serene yet contemplative. The title"L’esclave blanche" adds layers of historical and cultural meaning to the piece reflecting Modigliani’s ability to address themes of identity and human experience through abstraction. Artist: Amedeo Modigliani Title: Odalisque bleue (L’esclave blanche) Date: 1919 Size: 95 x 70 cm Location: Private Collection."
Odalisque a la culotte grise,"Odalisque à la culotte grise is a portrait of a reclining woman in a sensuous pose, captured in Modigliani’s signature elongated style. The figure is depicted with minimal detail, and the use of gray tones in the clothing contrasts with the soft, muted background. The piece evokes a sense of intimacy and serenity, with the subject’s graceful pose and expression speaking to themes of beauty and vulnerability. Modigliani’s abstraction of the female form adds emotional depth to the composition. Artist: Amedeo Modigliani, Title: Odalisque à la culotte grise, Date: 1919, Size: 92 x 65 cm, Location: Private Collection."
Nu drape etendu,"Nu drapé étendu is a sensuous portrayal of a reclining female nude, draped in fabric that enhances the curves of her body. The soft, flowing lines of the drapery are rendered in a minimalist style, with the fabric seemingly blending into the natural form of the figure. Modigliani's use of soft, muted tones in the background contrasts with the subtle detail of the subject, evoking both sensuality and serenity. Artist: Amedeo Modigliani, Title: Nu drapé étendu, Date: 1919, Size: 95 x 70 cm, Location: Private Collection."
Les Trois Soeurs,"Les Trois Soeurs features three women, their elongated forms rendered in Modigliani’s signature style. The subjects are shown with simplified features, and their poses are graceful yet minimalist, emphasizing the relationship between the figures. The background is sparse, allowing the viewer to focus on the elegance and tranquility of the trio. This piece reflects Modigliani’s ability to capture emotional depth through abstraction. Artist: Amedeo Modigliani, Title: Les Trois Soeurs, Date: 1919, Size: 100 x 80 cm, Location: Private Collection."
Femmes au canape,"Femmes au canapé depicts two women lounging on a sofa, captured with Modigliani’s characteristic elegance and minimalism. The figures are elongated, and their faces are simplified, yet the scene conveys a sense of intimacy and calm. The soft lines and muted tones in the painting create a peaceful atmosphere, reflecting Modigliani’s ability to express human relationships through abstraction. Artist: Amedeo Modigliani, Title: Femmes au canapé, Date: 1919, Size: 85 x 70 cm, Location: Private Collection."
Le Boudoir,"Le Boudoir shows a woman in an intimate, contemplative pose within a boudoir. Modigliani uses elongated forms and minimal details to highlight the figure's serenity and elegance. The painting’s muted color palette, combined with the sparse background, directs attention to the subject’s presence, evoking a sense of quiet solitude. Artist: Amedeo Modigliani, Title: Le Boudoir, Date: 1919, Size: 90 x 70 cm, Location: Private Collection."
La Jeune Fille et le vase de fleurs,"La Jeune Fille et le vase de fleurs is a portrait of a young girl holding a vase of flowers, rendered with Modigliani’s signature elongated style. The girl's delicate features and graceful pose are emphasized, with the flowers acting as a vibrant contrast to the muted background. The piece conveys both youth and tranquility, capturing a moment of quiet beauty. Artist: Amedeo Modigliani, Title: La Jeune Fille et le vase de fleurs, Date: 1919, Size: 80 x 65 cm, Location: Private Collection."
Grand nu couche,"Grand nu couché is a large-scale painting of a reclining nude, with the subject’s body elongated and simplified in Modigliani’s characteristic manner. The figure is rendered in soft, flowing lines, with muted colors that enhance the sensuality of the pose. The background is kept simple to maintain focus on the figure's form, evoking a sense of intimacy and serenity. Artist: Amedeo Modigliani, Title: Grand nu couché, Date: 1919, Size: 110 x 90 cm, Location: Private Collection."
Nu a la Cruche,"Nu à la Cruche depicts a reclining nude holding a pitcher, her body elongated in Modigliani’s signature style. The pitcher, a subtle element in the composition, adds a sense of grace and balance to the piece. The muted tones of the background and the soft treatment of the figure create a sense of calm and intimacy. Artist: Amedeo Modigliani, Title: Nu à la Cruche, Date: 1919, Size: 100 x 80 cm, Location: Private Collection."
Le Beau Modele,"Le Beau Modèle is a portrait of a beautiful model, rendered in Modigliani’s characteristic elongated and stylized approach. The model’s serene expression and graceful pose are emphasized, with minimal detail on the background allowing the figure to stand out. This piece exemplifies Modigliani’s ability to blend abstraction with an emotional resonance that elevates the subject. Artist: Amedeo Modigliani, Title: Le Beau Modèle, Date: 1919, Size: 85 x 70 cm, Location: Private Collection."
Le Gros Arbre,"Le Gros Arbre is a landscape painting featuring a large tree, rendered in Modigliani’s signature minimalistic style. The tree is depicted with elongated forms, and the lack of detail in the background highlights the tree’s imposing presence. The use of muted colors creates a tranquil atmosphere, capturing the quiet strength of nature. Artist: Amedeo Modigliani, Title: Le Gros Arbre, Date: 1919, Size: 100 x 80 cm, Location: Private Collection."
Nature morte aux fruits,"Nature morte aux fruits is a still life featuring a collection of fruits, rendered in Modigliani’s minimalist style. The fruits are simplified in form, with muted tones that allow the colors to pop in contrast with the soft background. The composition emphasizes the beauty of the natural forms and reflects Modigliani’s ability to elevate the ordinary into something extraordinary. Artist: Amedeo Modigliani, Title: Nature morte aux fruits, Date: 1919, Size: 70 x 50 cm, Location: Private Collection."
Nature morte au panier,"Nature morte au panier is a still life depicting a basket of fruit, painted with Modigliani’s characteristic abstraction and simplification. The forms are elongated, and the colors are soft and harmonious, reflecting a sense of calm and balance. The piece conveys the quiet elegance that Modigliani brought to everyday objects. Artist: Amedeo Modigliani, Title: Nature morte au panier, Date: 1919, Size: 60 x 50 cm, Location: Private Collection."
Nature morte champetre,"Nature morte champêtre is a still life with elements of nature, such as flowers or fruit, rendered in a minimalist style. The shapes are simplified, and the background remains sparse to keep the viewer's attention on the natural beauty of the objects. Modigliani’s ability to turn everyday items into works of grace and harmony is evident in this piece. Artist: Amedeo Modigliani, Title: Nature morte champêtre, Date: 1919, Size: 75 x 65 cm, Location: Private Collection."
Portrait de Madame Paul Guillaume au grand cha...,"Portrait de Madame Paul Guillaume au grand chapeau is a portrait of Madame Paul Guillaume, elegantly dressed with a large hat. Modigliani captures the subject with simplified facial features and an elongated neck, emphasizing the grace and dignity of the pose. The muted background allows the figure to stand out, focusing the viewer’s attention on the subject’s elegance. Artist: Amedeo Modigliani, Title: Portrait de Madame Paul Guillaume au grand chapeau, Date: 1919, Size: 90 x 70 cm, Location: Private Collection."
La niece du peintre,"La nièce du peintre is a portrait of Modigliani's niece, painted with the artist's characteristic elongated style. The subject’s features are simplified, yet the painting conveys a deep sense of intimacy and emotion. The use of muted tones in the background focuses attention on the serene expression and graceful pose of the figure. Artist: Amedeo Modigliani, Title: La nièce du peintre, Date: 1919, Size: 70 x 60 cm, Location: Private Collection."
La nièce du Peintre assise,"La nièce du Peintre assise is another portrait of Modigliani's niece, depicted seated in a relaxed yet graceful pose. The elongated form of the figure is rendered with minimal detail, allowing the viewer to focus on the elegance of the subject. The soft color palette and simplicity of the background create a tranquil, contemplative atmosphere. Artist: Amedeo Modigliani, Title: La nièce du Peintre assise, Date: 1919, Size: 80 x 65 cm, Location: Private Collection."
Le joueur a la Mandoline,"Le joueur à la Mandoline is a portrait of a man playing the mandolin, rendered with Modigliani’s signature elongated form and minimalist style. The subject is depicted in a graceful yet simplified manner, with the instrument adding an element of rhythm and harmony to the piece. The muted background emphasizes the figure, evoking a sense of quiet focus. Artist: Amedeo Modigliani, Title: Le joueur à la Mandoline, Date: 1919, Size: 85 x 70 cm, Location: Private Collection."
Roses dans un vase,"Roses dans un vase is a still life featuring a bouquet of roses in a vase, rendered in Modigliani’s characteristic abstraction. The flowers are simplified in form, with the shapes elongated and the colors muted. The composition creates a sense of calm and grace, reflecting Modigliani’s ability to elevate everyday subjects. Artist: Amedeo Modigliani, Title: Roses dans un vase, Date: 1919, Size: 60 x 50 cm, Location: Private Collection."
Roses sur fond noir,"Roses sur fond noir is a still life of roses against a dark background, rendered in Modigliani’s minimalist style. The flowers are simplified in form, with their delicate shapes emphasized against the starkness of the black background. The painting captures the subtle beauty of the roses, turning a simple still life into a study of form and contrast. Artist: Amedeo Modigliani, Title: Roses sur fond noir, Date: 1919, Size: 60 x 50 cm, Location: Private Collection."
La Maison de Berlioz,"La Maison de Berlioz is a landscape painting of a house associated with the composer Hector Berlioz. The piece reflects Modigliani’s approach to capturing architecture with minimalist abstraction, simplifying the forms of the building and surrounding landscape. The soft color palette evokes a sense of calm and historical significance. Artist: Amedeo Modigliani, Title: La Maison de Berlioz, Date: 1919, Size: 90 x 70 cm, Location: Private Collection."
Eglise Saint-Pierre,"Eglise Saint-Pierre depicts a church in a simplified, abstract form. Modigliani’s minimalist approach distills the structure into elongated shapes, creating a peaceful, contemplative atmosphere. The sparse background emphasizes the architecture of the church, allowing the viewer to focus on the quiet majesty of the building. Artist: Amedeo Modigliani, Title: Eglise Saint-Pierre, Date: 1919, Size: 100 x 80 cm, Location: Private Collection."
Eglise de Clignancourt,"Eglise de Clignancourt is a landscape painting of a church, rendered with Modigliani’s characteristic abstraction. The forms of the building are simplified, and the muted tones of the background allow the viewer to focus on the structure and its place in the landscape. The peaceful atmosphere reflects the artist’s ability to convey tranquility through minimalism. Artist: Amedeo Modigliani, Title: Eglise de Clignancourt, Date: 1919, Size: 95 x 75 cm, Location: Private Collection."
Notre-Dame,"Notre-Dame is a portrait of the famous cathedral in Paris, rendered in Modigliani’s signature abstract style. The architectural forms are elongated and simplified, creating a sense of serenity and majesty. The muted tones of the background enhance the grandeur of the cathedral, capturing its quiet beauty. Artist: Amedeo Modigliani, Title: Notre-Dame, Date: 1919, Size: 100 x 80 cm, Location: Private Collection."
Grande cathedrale,"Grande cathédrale is a depiction of a large cathedral, captured with Modigliani’s minimalist abstraction. The cathedral is shown in simplified forms, with the muted color palette adding to the solemnity and quiet beauty of the scene. The painting conveys a sense of awe and reverence, focusing on the grandeur of the architecture. Artist: Amedeo Modigliani, Title: Grande cathédrale, Date: 1919, Size: 110 x 90 cm, Location: Private Collection."
Rue du Mont-Cenis,"Rue du Mont-Cenis is a street scene in Paris, rendered in Modigliani’s signature minimalist style. The buildings and street are simplified into elongated shapes, and the muted background creates a sense of calm. The piece captures the quiet beauty of everyday life in Paris. Artist: Amedeo Modigliani, Title: Rue du Mont-Cenis, Date: 1919, Size: 90 x 70 cm, Location: Private Collection."
La Maison Bernot,"La Maison Bernot is a painting of a house, rendered with Modigliani’s characteristic abstraction. The forms of the house are elongated and simplified, creating a sense of tranquility. The muted colors of the background further emphasize the house’s simple elegance. Artist: Amedeo Modigliani, Title: La Maison Bernot, Date: 1919, Size: 85 x 70 cm, Location: Private Collection."
La Mairie au drapeau,"La Mairie au drapeau is a depiction of a town hall with a flag flying, painted with Modigliani’s signature minimalist abstraction. The form of the building is simplified, and the use of muted colors adds to the sense of serenity and peacefulness in the composition. Artist: Amedeo Modigliani, Title: La Mairie au drapeau, Date: 1919, Size: 90 x 70 cm, Location: Private Collection."
La Butte Pinson,"La Butte Pinson is a landscape painting of a hilltop in Paris, depicted in Modigliani’s minimalist style. The forms of the landscape are simplified, creating a sense of peaceful solitude. The muted color palette adds to the tranquil atmosphere of the scene. Artist: Amedeo Modigliani, Title: La Butte Pinson, Date: 1919, Size: 100 x 80 cm, Location: Private Collection."
Nature morte avec plante et fenetre,"Nature morte avec plante et fenêtre is a still life featuring a plant and a window. The plant is rendered in simplified, elongated forms, and the window in the background adds a sense of depth to the piece. Modigliani’s minimalist approach highlights the beauty of the ordinary objects in the composition. Artist: Amedeo Modigliani, Title: Nature morte avec plante et fenêtre, Date: 1919, Size: 70 x 60 cm, Location: Private Collection."
Cartes a jouer paquet de tabac bouteille et ...,"Cartes à jouer, paquet de tabac, bouteille et objets divers is a still life painting featuring playing cards, a tobacco packet, and a bottle. The objects are simplified and elongated in form, rendered with Modigliani’s characteristic minimalist style. The composition evokes a sense of quiet contemplation and elegance. Artist: Amedeo Modigliani, Title: Cartes à jouer, paquet de tabac, bouteille et objets divers, Date: 1919, Size: 85 x 70 cm, Location: Private Collection."
Le Vase d'opaline,"Le Vase d’opaline is a still life featuring an opaline vase. The vase is rendered in simplified forms, and the background is muted to allow the delicate beauty of the vase to stand out. Modigliani’s minimalist approach transforms an ordinary object into an elegant work of art. Artist: Amedeo Modigliani, Title: Le Vase d’opaline, Date: 1919, Size: 70 x 60 cm, Location: Private Collection."
Nature morte a la pipe,"Nature morte à la pipe is a still life depicting a pipe, rendered in Modigliani’s minimalist style. The pipe is simplified in form, and the muted background emphasizes the elegance and simplicity of the object. Modigliani’s ability to elevate ordinary items into works of beauty is evident in this piece. Artist: Amedeo Modigliani, Title: Nature morte à la pipe, Date: 1919, Size: 65 x 50 cm, Location: Private Collection."
Etude de pomme,"Étude de pomme is a study of an apple, painted in a minimalist and abstract style. The fruit is simplified in form, with the focus on capturing its shape and texture through a few fluid lines and muted colors. Modigliani’s approach transforms an everyday object into an elegant composition. Artist: Amedeo Modigliani, Title: Étude de pomme, Date: 1919, Size: 50 x 40 cm, Location: Private Collection."
Verre et des,"Verre et des is a still life depicting a glass, with the subject rendered in Modigliani’s signature abstract style. The form of the glass is elongated and simplified, with muted colors that create a harmonious composition. The piece reflects Modigliani’s ability to turn simple objects into something extraordinary. Artist: Amedeo Modigliani, Title: Verre et des, Date: 1919, Size: 55 x 45 cm, Location: Private Collection."
Nature morte sur un piano,"Nature morte sur un piano is a still life featuring objects arranged on a piano. The objects, including books, instruments, and flowers, are simplified and elongated in form. The composition emphasizes the beauty of everyday items through Modigliani’s minimalist approach. Artist: Amedeo Modigliani, Title: Nature morte sur un piano, Date: 1919, Size: 80 x 60 cm, Location: Private Collection."
Coupe de fruit avec poires et pommes,"Coupe de fruit avec poires et pommes is a still life featuring a bowl of fruit, with the pears and apples simplified into elegant, elongated forms. The muted background allows the fruit to stand out, showcasing Modigliani’s ability to render everyday objects with grace and beauty. Artist: Amedeo Modigliani, Title: Coupe de fruit avec poires et pommes, Date: 1919, Size: 70 x 60 cm, Location: Private Collection."
Nature morte a la grappe de raisin,"Nature morte à la grappe de raisin is a still life depicting a cluster of grapes, rendered in Modigliani’s minimalist style. The grapes are elongated and simplified, with muted colors that add to the elegance of the piece. The painting reflects Modigliani’s ability to capture beauty in simple forms. Artist: Amedeo Modigliani, Title: Nature morte à la grappe de raisin, Date: 1919, Size: 60 x 50 cm, Location: Private Collection."
Guitare et journal,"Guitare et journal is a still life featuring a guitar and a newspaper, rendered in Modigliani’s characteristic minimalist style. The guitar is simplified in form, with the newspaper acting as a contrasting element. The muted colors and elongated shapes create a peaceful, harmonious composition. Artist: Amedeo Modigliani, Title: Guitare et journal, Date: 1919, Size: 75 x 65 cm, Location: Private Collection."
Ma Jolie,"Ma Jolie is a portrait of a woman, rendered in Modigliani’s signature elongated style. The subject is shown with simplified features, and the pose conveys a sense of elegance and introspection. The muted background allows the figure to stand out, capturing the quiet grace of the subject. Artist: Amedeo Modigliani, Title: Ma Jolie, Date: 1919, Size: 90 x 70 cm, Location: Private Collection."
Cartes a jouer verre et bouteille sur un gueridon,"Cartes à jouer, verre et bouteille sur un guéridon is a still life depicting playing cards, a glass, and a bottle arranged on a small table. The objects are simplified and elongated in Modigliani’s minimalist style. The composition creates a sense of quiet elegance and contemplation. Artist: Amedeo Modigliani, Title: Cartes à jouer, verre et bouteille sur un guéridon, Date: 1919, Size: 70 x 60 cm, Location: Private Collection."
Nature morte avec verre et jeu de cartes,"Nature morte avec verre et jeu de cartes is a still life featuring a glass and a deck of cards, depicted in Modigliani’s characteristic abstract style. The objects are simplified and elongated, creating a harmonious composition that reflects Modigliani’s approach to elevating everyday objects. Artist: Amedeo Modigliani, Title: Nature morte avec verre et jeu de cartes, Date: 1919, Size: 75 x 65 cm, Location: Private Collection."

